{
  "schema": "nyra.resource.metadata",
  "version": 1,
  "id": "sha256:cccccccccccccccccccccccccccccccccccccccccccccccccccccccccccccccc",
  "kind": "book",
  "title": "A Field Guide to the Night Sky",
  "creator": "Example Author",
  "language": "en",
  "importedAt": "2026-01-15T12:00:00Z",
  "source": {
    "type": "local-file",
    "label": "User-selected EPUB"
  },
  "original": {
    "filename": "night-sky.epub",
    "mediaType": "application/epub+zip",
    "size": 1048576,
    "sha256": "cccccccccccccccccccccccccccccccccccccccccccccccccccccccccccccccc",
    "immutable": true
  }
}
